{"schema_version":"0.1.0","decision_id":"pd_regis_ingest_quarantine_001","decision_status":"quarantine","policy_request_ref":{"request_id":"prq_regis_ingest_tpf_001","request_hash":"sha256:5fe821fdd6971bbc436f7e410c5d8705392517bb3ee58e06bd4ecc327f0a73c9"},"input_hash":"sha256:5fe821fdd6971bbc436f7e410c5d8705392517bb3ee58e06bd4ecc327f0a73c9","decision_made_at":"2026-05-12T04:10:05Z","decision_valid_until":"2026-05-12T05:10:00Z","issuer":{"issuer_id":"policy_fabric_local_001","issuer_type":"policy_fabric","policy_engine_version":"policy-fabric-test-0.1.0"},"min_signatures":1,"granted_actions":[],"restrictions":["DoNotLearn","DoNotLink","NoRawTwinExport"],"reason_codes":["safety_quarantine"],"canonicalization":"rfc8785-jcs-v0.1","payload_hash":"sha256:58083c0616aada2cdfbf233241de51098901d5fa20e6129e6569af87f3549c07","signatures":[{"algorithm":"hmac-sha256-test-v0.1","key_id":"test-policy-key","value":"sha256:8b58da20bac93be1a2f74f176d5e9d7d2316fd6d35ffb755ad5af53e7d333b87"}]}