{"schema_version":"0.1.0","decision_id":"pd_regis_ingest_revoke_001","decision_status":"revoke","policy_request_ref":{"request_id":"prq_regis_ingest_tpf_001","request_hash":"sha256:5fe821fdd6971bbc436f7e410c5d8705392517bb3ee58e06bd4ecc327f0a73c9"},"input_hash":"sha256:5fe821fdd6971bbc436f7e410c5d8705392517bb3ee58e06bd4ecc327f0a73c9","decision_made_at":"2026-05-12T04:10:05Z","decision_valid_until":"2026-05-12T05:10:00Z","issuer":{"issuer_id":"policy_fabric_local_001","issuer_type":"policy_fabric","policy_engine_version":"policy-fabric-test-0.1.0"},"min_signatures":1,"granted_actions":[],"restrictions":["DoNotLearn","DoNotLink","NoRawTwinExport"],"reason_codes":["revoked_by_authority"],"canonicalization":"rfc8785-jcs-v0.1","revokes_decision_ref":"pd_regis_ingest_tpf_001","payload_hash":"sha256:89f1ca041e8d7debbb916dd7c2a56033b5db1d847084803d6819e1fca1594be3","signatures":[{"algorithm":"hmac-sha256-test-v0.1","key_id":"test-policy-key","value":"sha256:c9647d8b7872bacb2848540ea2e2bd6f048fc8d4e5f6c613b5ddad3c819c3a8a"}]}